{
  "schema_version": "1.0",
  "message_id": "00000000-0000-4000-8000-000000000002",
  "session_id": "00000000-0000-4000-8000-0000000000a1",
  "user_id": "synthetic-user-1",
  "produced_at": "2026-10-06T06:00:01.000Z",
  "kind": "features",
  "body": {
    "schema_version": "2.0",
    "feature_version": "shoulder-relative-deltas-v1",
    "baseline_id": "00000000-0000-4000-8000-000000000001",
    "sequence": 0,
    "start_ms": 0,
    "end_ms": 1000,
    "phase": "running",
    "measurement_quality": "good",
    "features": {
      "head_gap_delta": 0.0,
      "lateral_offset_delta": 0.2,
      "shoulder_tilt_delta": 0.0,
      "current_quality": 0.9,
      "baseline_quality": 0.8
    }
  }
}
