{
  "schema_version": "1.0",
  "message_id": "00000000-0000-4000-8000-000000000001",
  "session_id": "00000000-0000-4000-8000-0000000000a1",
  "user_id": "synthetic-user-1",
  "produced_at": "2026-10-06T06:00:00.000Z",
  "kind": "session_started",
  "body": {
    "policy": {
      "hold_ms": 3000,
      "recovery_ms": 2000,
      "reminder_ms": 60000,
      "threshold": 0.7
    },
    "baseline_id": "00000000-0000-4000-8000-000000000001",
    "frame": {
      "width": 640,
      "height": 480
    }
  }
}
